<?xml version="1.0" encoding="UTF-8"?>

<ActionGroups xmlns:xsi="http://www.w3.org/2001/XMLSchema-instance"
	xsi:noNamespaceSchemaLocation="../../org.testeditor.xmllibrary/resources/AllActionGroups.xsd"
		schemaVersion="1.1">

	<ActionGroup name="Allgemein Browser">
		<action technicalBindingType="Starte_Browser">
			<actionName locator="Firefox">Firefox</actionName>
		</action>
		<action technicalBindingType="Starte_Browser">
			<actionName locator="IE">IE</actionName>
		</action>
		<action technicalBindingType="Navigiere_auf_Seite" />
		<action technicalBindingType="Beende_Browser" />
		<action technicalBindingType="Warte_Sekunden" />
		<action technicalBindingType="Pruefe_Wert_vorhanden" />
		<action technicalBindingType="Pruefe_Wert_nicht_vorhanden" />
	</ActionGroup>

	<ActionGroup name="Anmeldung">
		<action technicalBindingType="Eingabe_Wert">
			<actionName locator="Name">Name</actionName>
		</action>
		<action technicalBindingType="Eingabe_Wert">
			<actionName locator="Passwort">Passwort</actionName>
		</action>
		<action technicalBindingType="Leere_Wert">
			<actionName locator="Name">Name</actionName>
		</action>
		<action technicalBindingType="Leere_Wert">
			<actionName locator="Passwort">Passwort</actionName>
		</action>
		<action technicalBindingType="Button_Druecken">
			<actionName locator="Login">Login</actionName>
		</action>
		<action technicalBindingType="Auswahl_Wert">
       		<actionName locator="land"> Land </actionName>
		       <argument id="argument1">
		              <value>Deutschland</value>
		              <value>Italien</value>
		              <value>USA</value>
		              <value>Schweden</value>
		              <value>Australien</value>
		       </argument>
		</action>
		<action technicalBindingType="Auswahl_Wert_andersrum">
       		<actionName locator="land_2"> Land_2 </actionName>
		       <argument id="argument2">
		              <value>Deutschland</value>
		              <value>Italien</value>
		              <value>USA</value>
		              <value>Schweden</value>
		              <value>Australien</value>
		       </argument>
		</action>
		<action technicalBindingType="Auswahl_Wert_andersrum">
       		<actionName locator="WÃ¤hrung"> Waehrung </actionName>
		       <argument id="argument2">
		              <value>USD</value>
		              <value>Euro</value>
		              <value>Rubel</value>
		       </argument>
		</action>
		
	</ActionGroup>
	
</ActionGroups>
