<?xml version="1.0" encoding="UTF-8"?>

<ActionGroups xmlns:xsi="http://www.w3.org/2001/XMLSchema-instance"
	xsi:noNamespaceSchemaLocation="http://testeditor.org/xsd_schema/v_1_1/AllActionGroups.xsd"
	schemaVersion="1.1">

	<ActionGroup name="Allgemein Browser">
		<action technicalBindingType="Starte_Browser">
			<actionName locator="Firefox">Firefox</actionName>
		</action>
		<action technicalBindingType="Starte_Browser">
			<actionName locator="IE">IE</actionName>
		</action>
		<action technicalBindingType="Navigiere_auf_Seite" />
		<action technicalBindingType="Beende_Browser" />
		<action technicalBindingType="Warte_Sekunden" />
		<action technicalBindingType="Pruefe_Text_Vorhanden" />
		<action technicalBindingType="Pruefe_Text_Nicht_Vorhanden" />
		<action technicalBindingType="Seitenaufbau_Abwarten" />
	</ActionGroup>

	<ActionGroup name="Lokale Anmeldung">
		<action technicalBindingType="Eingabe_Wert">
			<actionName locator="user">Name</actionName>
		</action>
		<action technicalBindingType="Eingabe_Wert">
			<actionName locator="password">Passwort</actionName>
		</action>
		<action technicalBindingType="Leere_Wert">
			<actionName locator="user">Name</actionName>
		</action>
		<action technicalBindingType="Leere_Wert">
			<actionName locator="password">Passwort</actionName>
		</action>
		<action technicalBindingType="Auswahl_Wert">
			<actionName locator="land"> Land </actionName>
			<argument id="argument1">
				<value>Deutschland</value>
				<value>Italien</value>
				<value>USA</value>
				<value>Schweden</value>
				<value>Australien</value>
			</argument>
		</action>
		<action technicalBindingType="Klicke_Element">
			<actionName locator="login">Login</actionName>
		</action>
		<action technicalBindingType="Pruefe_Text_In_Element">
			<actionName locator="user">Name</actionName>
		</action>
		<action technicalBindingType="Pruefe_Text_In_Element">
			<actionName locator="password">Passwort</actionName>
		</action>
		<action technicalBindingType="Pruefe_Text_In_Element">
			<actionName locator="headline">Ãœberschrift</actionName>
		</action>
	</ActionGroup>

	<ActionGroup name="Google Suche">
		<action technicalBindingType="Eingabe_Wert">
			<actionName locator="searchInput">Sucheingabe</actionName>
		</action>
		<action technicalBindingType="Klicke_Element">
			<actionName locator="searchButton">Suche</actionName>
		</action>
	</ActionGroup>

</ActionGroups>
