<?xml version="1.0" encoding="UTF-8"?>

<ActionGroups xmlns:xsi="http://www.w3.org/2001/XMLSchema-instance"
	xsi:noNamespaceSchemaLocation="http://testeditor.org/xsd_schema/v_1_1/AllActionGroups.xsd"
	schemaVersion="1.1">

	<ActionGroup name="Allgemein Browser">
		<action technicalBindingType="Starte_Browser">
			<actionName locator="Firefox">Firefox</actionName>
		</action>
		<action technicalBindingType="Starte_Browser">
			<actionName locator="IE">IE</actionName>
		</action>
		<action technicalBindingType="Navigiere_auf_Seite" />
		<action technicalBindingType="Beende_Browser" />
		<action technicalBindingType="Warte_Sekunden" />
		<action technicalBindingType="Pruefe_Text_Vorhanden" />
		<action technicalBindingType="Pruefe_Text_Nicht_Vorhanden" />
		<action technicalBindingType="Seitenaufbau_Abwarten" />
	</ActionGroup>

</ActionGroups>
